{
  "strategy_id": "orb_5m_v1",
  "version": "1.0.0",
  "created_at": "2026-03-22T00:00:00Z",
  "description": "Opening Range Breakout 5M. Etablit le range de la 1ere bougie du jour, entre en breakout avec filtre volume. Optimal sur indices (DAX, SP500) en ouverture de session.",
  "asset": "IX.D.DAX.DAILY.IP",
  "timeframe": "5M",
  "parameters": {
    "volume_multiplier": 1.5,
    "volume_lookback": 20,
    "stop_loss_pct": 0.5,
    "take_profit_pct": 1.2,
    "trailing_stop_pct": 0.25,
    "max_position_pct": 0.02
  },
  "entry_rules": {
    "long": "or_established=1 ET close > or_high ET volume > 1.5 * avg_volume(20)",
    "short": "or_established=1 ET close < or_low ET volume > 1.5 * avg_volume(20)"
  },
  "exit_rules": {
    "long": "trailing_stop=0.25% OU take_profit=1.2% OU stop_loss=0.5%",
    "short": "trailing_stop=0.25% OU take_profit=1.2% OU stop_loss=0.5%"
  },
  "cost_model": {
    "spread_pct": 0.01,
    "slippage_pct": 0.02,
    "commission_per_lot": 0
  },
  "validation_requirements": {
    "min_trades": 30,
    "min_sharpe": 1.2,
    "max_drawdown_pct": 20,
    "walk_forward_windows": 5,
    "out_of_sample_pct": 30,
    "min_profit_factor": 1.3
  },
  "risk_management": {
    "max_position_pct": 0.02,
    "max_open_trades": 1,
    "daily_loss_limit_pct": 0.03
  },
  "tags": [
    "breakout",
    "orb",
    "indices",
    "5m",
    "intraday",
    "volume_filter"
  ]
}