{
  "strategy_id": "rsi_mean_reversion_v1",
  "version": "1.0.0",
  "created_at": "2026-03-22T00:00:00Z",
  "description": "Mean reversion RSI sur EUR/USD 1H. Entrée sur croisement des zones extrêmes (oversold/overbought), sortie sur retour vers la zone neutre (50). Stop loss et take profit fixes en % du prix d'entrée.",
  "asset": "CS.D.EURUSD.MINI.IP",
  "timeframe": "1H",
  "parameters": {
    "rsi_period": 14,
    "oversold": 30,
    "overbought": 70,
    "stop_loss_pct": 0.5,
    "take_profit_pct": 1.0,
    "max_position_pct": 0.02
  },
  "entry_rules": {
    "long": "rsi_prev < oversold AND rsi_prev2 >= oversold",
    "short": "rsi_prev > overbought AND rsi_prev2 <= overbought"
  },
  "exit_rules": {
    "long": "rsi_prev > 50 OR stop_loss hit OR take_profit hit",
    "short": "rsi_prev < 50 OR stop_loss hit OR take_profit hit"
  },
  "cost_model": {
    "spread_pct": 0.007,
    "slippage_pct": 0.003,
    "commission_per_lot": 0.0
  },
  "validation_requirements": {
    "min_trades": 50,
    "min_sharpe": 0.5,
    "max_drawdown_pct": 20,
    "walk_forward_windows": 4,
    "out_of_sample_pct": 30,
    "min_profit_factor": 1.1
  },
  "risk_management": {
    "max_position_pct": 0.02,
    "max_open_trades": 1,
    "daily_loss_limit_pct": 0.03
  },
  "tags": [
    "mean_reversion",
    "forex",
    "oscillator",
    "rsi",
    "intraday"
  ]
}