{
  "strategy_id": "vwap_mr_1m_v1",
  "version": "1.0.0",
  "created_at": "2026-03-22T00:00:00Z",
  "description": "VWAP Mean Reversion 1M avec sigma bands. Entry quand prix s'ecarte de plus de 2σ du VWAP, sortie au retour vers VWAP. Optimal en range intraday.",
  "asset": "EURUSD",
  "timeframe": "1M",
  "parameters": {
    "atr_period": 14,
    "entry_std": 2.0,
    "exit_std": 0.3,
    "use_sigma_bands": 1,
    "sigma_period": 20,
    "stop_loss_pct": 0.3,
    "take_profit_pct": 0.6,
    "trailing_stop_pct": 0.15,
    "max_position_pct": 0.02
  },
  "entry_rules": {
    "long": "close < vwap - 2*sigma (sigma = rolling 20-bar std) ET sigma != NaN",
    "short": "close > vwap + 2*sigma"
  },
  "exit_rules": {
    "long": "close > vwap - 0.3*sigma (retour VWAP) OU stop_loss=0.3% OU take_profit=0.6%",
    "short": "close < vwap + 0.3*sigma OU stop_loss=0.3% OU take_profit=0.6%"
  },
  "cost_model": {
    "spread_pct": 0.007,
    "slippage_pct": 0.003,
    "commission_per_lot": 0
  },
  "validation_requirements": {
    "min_trades": 50,
    "min_sharpe": 1.2,
    "max_drawdown_pct": 20,
    "walk_forward_windows": 5,
    "out_of_sample_pct": 30,
    "min_profit_factor": 1.3
  },
  "risk_management": {
    "max_position_pct": 0.02,
    "max_open_trades": 1,
    "daily_loss_limit_pct": 0.03
  },
  "tags": [
    "mean_reversion",
    "vwap",
    "forex",
    "1m",
    "intraday",
    "sigma_bands"
  ]
}