{
  "strategy_id": "bb_squeeze_5m_opt_v1",
  "version": "1.0.0",
  "created_at": "2026-03-22T16:53:59Z",
  "description": "[OPTIMISE] Bollinger Band Squeeze Breakout 5M. Entre quand les BB se re-elargissent apres une compression (squeeze), avec filtre de direction EMA9/21. Capture les expansions de volatilite. — params optimises par grid search IS/OOS sur SOL",
  "asset": "SOL",
  "timeframe": "5M",
  "parameters": {
    "bb_period": 26.0,
    "bb_std": 2,
    "squeeze_ma_period": 20,
    "ema_fast": 7.0,
    "ema_slow": 18.0,
    "squeeze_threshold": 0.95,
    "stop_loss_pct": 0.5,
    "take_profit_pct": 1.5,
    "trailing_stop_pct": 0.3,
    "max_position_pct": 0.02
  },
  "entry_rules": {
    "long": "BB_width < 0.95*MA(BB_width,20) pendant N barres, puis BB_width depasse seuil ET EMA9 > EMA21",
    "short": "Sortie du squeeze ET EMA9 < EMA21 (momentum baissier)"
  },
  "exit_rules": {
    "long": "trailing_stop=0.3% OU take_profit=1.5% OU stop_loss=0.5%",
    "short": "trailing_stop=0.3% OU take_profit=1.5% OU stop_loss=0.5%"
  },
  "cost_model": {
    "spread_pct": 0.007,
    "slippage_pct": 0.003,
    "commission_per_lot": 0
  },
  "validation_requirements": {
    "min_trades": 30,
    "min_sharpe": 1.2,
    "max_drawdown_pct": 20,
    "walk_forward_windows": 5,
    "out_of_sample_pct": 30,
    "min_profit_factor": 1.3
  },
  "risk_management": {
    "max_position_pct": 0.02,
    "max_open_trades": 1,
    "daily_loss_limit_pct": 0.03
  },
  "tags": [
    "breakout",
    "volatility",
    "bollinger",
    "squeeze",
    "forex",
    "5m",
    "intraday"
  ]
}