{
  "strategy_id": "seasonality_5m_v1",
  "version": "1.0.0",
  "created_at": "2026-03-22T00:00:00Z",
  "description": "Intraday Seasonality 5M. EMA9/21 crossover filtre uniquement sur la fenetre 08h-10h UTC (ouverture London). Les flux institutionnels sont concentres a l'ouverture, patterns plus fiables.",
  "asset": "EURUSD",
  "timeframe": "5M",
  "parameters": {
    "ema_fast": 9,
    "ema_slow": 21,
    "session_start_hour": 8,
    "session_end_hour": 10,
    "stop_loss_pct": 0.4,
    "take_profit_pct": 1.0,
    "trailing_stop_pct": 0.2,
    "max_position_pct": 0.02
  },
  "entry_rules": {
    "long": "08h <= heure < 10h UTC ET EMA9 croise au-dessus EMA21",
    "short": "08h <= heure < 10h UTC ET EMA9 croise en-dessous EMA21"
  },
  "exit_rules": {
    "long": "trailing_stop=0.2% OU take_profit=1.0% OU stop_loss=0.4%",
    "short": "trailing_stop=0.2% OU take_profit=1.0% OU stop_loss=0.4%"
  },
  "cost_model": {
    "spread_pct": 0.007,
    "slippage_pct": 0.003,
    "commission_per_lot": 0
  },
  "validation_requirements": {
    "min_trades": 30,
    "min_sharpe": 1.2,
    "max_drawdown_pct": 20,
    "walk_forward_windows": 5,
    "out_of_sample_pct": 30,
    "min_profit_factor": 1.3
  },
  "risk_management": {
    "max_position_pct": 0.02,
    "max_open_trades": 1,
    "daily_loss_limit_pct": 0.03
  },
  "tags": [
    "seasonality",
    "time_filter",
    "ema_crossover",
    "forex",
    "5m",
    "london_open"
  ]
}