{
  "strategy_id": "rsi_filtered_5m_v1",
  "version": "1.0.0",
  "created_at": "2026-03-22T00:00:00Z",
  "description": "RSI Mean Reversion Range 5M avec filtre ADX. Thresholds 25/75 + ADX < 20 pour ne trader qu'en marche laterale. Reduit drastiquement les faux signaux en tendance.",
  "asset": "EURUSD",
  "timeframe": "5M",
  "parameters": {
    "rsi_period": 14,
    "oversold": 25,
    "overbought": 75,
    "adx_period": 14,
    "adx_threshold": 20,
    "stop_loss_pct": 0.4,
    "take_profit_pct": 0.8,
    "trailing_stop_pct": 0.0,
    "max_position_pct": 0.02
  },
  "entry_rules": {
    "long": "ADX < 20 ET RSI croise 25 a la hausse (oversold → recovery)",
    "short": "ADX < 20 ET RSI croise 75 a la baisse (overbought → correction)"
  },
  "exit_rules": {
    "long": "stop_loss=0.4% OU take_profit=0.8% OU signal short",
    "short": "stop_loss=0.4% OU take_profit=0.8% OU signal long"
  },
  "cost_model": {
    "spread_pct": 0.007,
    "slippage_pct": 0.003,
    "commission_per_lot": 0
  },
  "validation_requirements": {
    "min_trades": 50,
    "min_sharpe": 1.2,
    "max_drawdown_pct": 20,
    "walk_forward_windows": 5,
    "out_of_sample_pct": 30,
    "min_profit_factor": 1.3
  },
  "risk_management": {
    "max_position_pct": 0.02,
    "max_open_trades": 1,
    "daily_loss_limit_pct": 0.03
  },
  "tags": [
    "mean_reversion",
    "rsi",
    "adx_filter",
    "forex",
    "5m",
    "intraday",
    "range"
  ]
}