{
  "strategy_id": "momentum_burst_1m_opt_v1",
  "version": "1.0.0",
  "created_at": "2026-03-22T16:54:12Z",
  "description": "[OPTIMISE] Momentum Burst 1M. EMA9/21 crossover avec spike de volume (>2x volume moyen). Capture les impulsions initiees par les institutionnels avec un engagement fort du marche. — params optimises par grid search IS/OOS sur ASML",
  "asset": "ASML",
  "timeframe": "1M",
  "parameters": {
    "ema_fast": 7.0,
    "ema_slow": 26.0,
    "volume_multiplier": 2.5,
    "volume_lookback": 20,
    "stop_loss_pct": 0.25,
    "take_profit_pct": 0.75,
    "trailing_stop_pct": 0.15,
    "max_position_pct": 0.02
  },
  "entry_rules": {
    "long": "EMA9 croise au-dessus EMA21 ET volume > 2.0 * avg_volume(20)",
    "short": "EMA9 croise en-dessous EMA21 ET volume > 2.0 * avg_volume(20)"
  },
  "exit_rules": {
    "long": "trailing_stop=0.15% OU take_profit=0.75% OU stop_loss=0.25%",
    "short": "trailing_stop=0.15% OU take_profit=0.75% OU stop_loss=0.25%"
  },
  "cost_model": {
    "spread_pct": 0.007,
    "slippage_pct": 0.003,
    "commission_per_lot": 0
  },
  "validation_requirements": {
    "min_trades": 50,
    "min_sharpe": 1.2,
    "max_drawdown_pct": 20,
    "walk_forward_windows": 5,
    "out_of_sample_pct": 30,
    "min_profit_factor": 1.3
  },
  "risk_management": {
    "max_position_pct": 0.02,
    "max_open_trades": 1,
    "daily_loss_limit_pct": 0.03
  },
  "tags": [
    "momentum",
    "ema_crossover",
    "volume_filter",
    "forex",
    "1m",
    "intraday"
  ]
}