{
  "strategy_id": "rsi_iwm_1d_iwm_opt_v1",
  "version": "1.0.0",
  "created_at": "2026-03-23T20:09:59Z",
  "description": "[OPTIMISE] RSI Mean Reversion sur IWM (Russell 2000 ETF) daily. Les small caps sont plus mean-reverting que les large caps en raison de leur liquidité réduite et de leur sensibilité plus forte aux cycles économiques. RSI(10) plus réactif que RSI(14) — capture les micro-extrèmes intra-semaine. Seuil overbought asymétrique (65 vs 30) : le marché monte plus facilement qu'il ne baisse, l'entrée short est donc plus sélective. — params optimises par grid search IS/OOS sur IWM",
  "asset": "IWM",
  "timeframe": "1D",
  "parameters": {
    "rsi_period": 8.0,
    "oversold": 25.0,
    "overbought": 60.0,
    "stop_loss_pct": 0.8,
    "take_profit_pct": 2.5,
    "trailing_stop_pct": 0.6,
    "max_position_pct": 0.05
  },
  "entry_rules": {
    "long": "RSI(10) crosses above 30 — Russell 2000 oversold bounce",
    "short": "RSI(10) crosses below 65 — Russell 2000 overbought reversal"
  },
  "exit_rules": {
    "long": "stop_loss(-1.0%) OR take_profit(+3.5%) OR trailing_stop(0.6% from peak) OR signal_short",
    "short": "stop_loss(+1.0%) OR take_profit(-3.5%) OR trailing_stop(0.6% from trough) OR signal_long"
  },
  "cost_model": {
    "spread_pct": 0.01,
    "slippage_pct": 0.02,
    "commission_per_lot": 0.0
  },
  "risk_management": {
    "max_position_pct": 0.05,
    "max_open_trades": 1,
    "daily_loss_limit_pct": 0.04
  },
  "validation_requirements": {
    "min_trades": 30,
    "min_sharpe": 0.8,
    "max_drawdown_pct": 20.0,
    "walk_forward_windows": 4,
    "out_of_sample_pct": 30,
    "min_profit_factor": 1.3
  },
  "tags": [
    "mean_reversion",
    "rsi",
    "iwm",
    "russell2000",
    "small_cap",
    "etf",
    "daily"
  ]
}