{
  "strategy_id": "gap_fill_spy_1d_v1",
  "version": "1.0.0",
  "created_at": "2026-03-23T00:00:00Z",
  "description": "Gap Fill Mean Reversion sur SPY daily. Fade les gaps techniques (1-3%) sans catalyst institutionnel (volume faible). Les gaps sans catalyst se remplissent a 70%+ historiquement. Position inverse du gap.",
  "asset": "SPY",
  "timeframe": "1D",
  "parameters": {
    "min_gap_pct": 1.0,
    "max_gap_pct": 3.0,
    "volume_max_multiplier": 1.5,
    "volume_lookback": 20,
    "stop_loss_pct": 1.5,
    "take_profit_pct": 1.5,
    "trailing_stop_pct": 0.4,
    "max_position_pct": 0.01
  },
  "entry_rules": {
    "long": "Gap down 1-3% AND volume < 1.5x avg (no catalyst) -> expect gap fill",
    "short": "Gap up 1-3% AND volume < 1.5x avg (no catalyst) -> expect gap fill"
  },
  "exit_rules": {
    "long": "stop_loss(-1.5%) OR take_profit(+1.5%) OR trailing_stop(0.4%)",
    "short": "stop_loss(+1.5%) OR take_profit(-1.5%) OR trailing_stop(0.4%)"
  },
  "cost_model": {
    "spread_pct": 0.01,
    "slippage_pct": 0.02,
    "commission_per_lot": 0.0
  },
  "risk_management": {
    "max_position_pct": 0.01,
    "max_open_trades": 1,
    "daily_loss_limit_pct": 0.02
  },
  "validation_requirements": {
    "min_trades": 15,
    "min_sharpe": 0.3,
    "max_drawdown_pct": 20.0,
    "walk_forward_windows": 4,
    "out_of_sample_pct": 30,
    "min_profit_factor": 1.1
  },
  "tags": [
    "gap_fill",
    "mean_reversion",
    "spy",
    "sp500",
    "daily"
  ]
}